Sl.No.,e-Published Date,Title and Ref.No./Tender Id,Organisation Name
1.,21-Aug-2018 02:00 PM,Tarpaulin 470/1720/DCR/Q / 2018_IHQ_374565_1,IHQ of MoD (Army)-(OSCC)
2.,07-Aug-2018 03:10 PM,supply of items no-SHQ(SNR)/QM/2018-5961 / 2018_ITBP_369681_1,"DG, Indo-Tibetan Border Police Force"
3.,14-Aug-2018 06:00 PM,SUPPLY OF TARPAULINE FOR GR RGRM185022 / 2018_GR_81220_1,IndianOil
4.,18-Aug-2018 03:00 PM,SUPPLY OF TARPAULIN AT BARAUNI REFINERY RBRM18R061 / 2018_BR_81407_1,IndianOil
5.,21-Aug-2018 07:00 PM,Supply of Fire Retardant Tarpaulin KKNPP/3&4/CMM/34278 / 41069,Nuclear Power Corporation of India Ltd
6.,11-Aug-2018 09:00 AM,MULTILAYER PLASTIC TARPAULIN SSI8432P19 / T1601775,Oil India Limited
